{
  "$schema": "../../schemas/operation-fixture.schema.json",
  "schemaVersion": 1,
  "id": "declarations.escaped-custom-property-name",
  "provenanceIds": [],
  "operations": [
    {
      "op": "constructStyleRule",
      "target": "$root",
      "handle": "rule",
      "args": [".x"]
    },
    {
      "op": "getStyle",
      "target": "rule",
      "handle": "style",
      "args": []
    },
    {
      "op": "setProperty",
      "target": "style",
      "args": ["--foo:bar", "red"]
    },
    {
      "op": "setProperty",
      "target": "style",
      "args": ["--foo\\:bar", "blue"],
      "observe": ["return", "exception", "cssText", "length", "items"]
    },
    {
      "op": "getPropertyValue",
      "target": "style",
      "args": ["--foo:bar"],
      "observe": ["return", "exception", "cssText"]
    },
    {
      "op": "getPropertyValue",
      "target": "style",
      "args": ["--foo\\:bar"],
      "observe": ["return", "exception", "cssText"]
    }
  ]
}
