{
  "$schema": "../../schemas/operation-fixture.schema.json",
  "schemaVersion": 1,
  "id": "declarations.custom-property-priority-replacement",
  "provenanceIds": [],
  "operations": [
    {
      "op": "constructStyleRule",
      "target": "$root",
      "handle": "rule",
      "args": [".x"]
    },
    {
      "op": "getStyle",
      "target": "rule",
      "handle": "style",
      "args": []
    },
    {
      "op": "setProperty",
      "target": "style",
      "args": ["--token", "red", "important"],
      "observe": ["return", "exception", "cssText", "length", "items"]
    },
    {
      "op": "setProperty",
      "target": "style",
      "args": ["--token", "red", ""],
      "observe": ["return", "exception", "cssText", "length", "items"]
    }
  ]
}
