{
  "$schema": "../../schemas/operation-fixture.schema.json",
  "schemaVersion": 1,
  "id": "declarations.required-arguments",
  "provenanceIds": [],
  "operations": [
    {
      "op": "constructStyleRule",
      "target": "$root",
      "handle": "rule",
      "args": [".x"]
    },
    {
      "op": "getStyle",
      "target": "rule",
      "handle": "style",
      "args": []
    },
    {
      "op": "setProperty",
      "target": "style",
      "args": ["color"],
      "observe": ["exception", "cssText"]
    },
    {
      "op": "getPropertyValue",
      "target": "style",
      "args": [],
      "observe": ["exception", "cssText"]
    }
  ]
}
