{
  "$schema": "../../schemas/operation-fixture.schema.json",
  "schemaVersion": 1,
  "id": "declarations.set-property-multiple-declarations",
  "provenanceIds": [],
  "operations": [
    {
      "op": "constructStyleRule",
      "target": "$root",
      "handle": "rule",
      "args": [".x"]
    },
    {
      "op": "getStyle",
      "target": "rule",
      "handle": "style",
      "args": []
    },
    {
      "op": "setProperty",
      "target": "style",
      "args": ["width", "10px"]
    },
    {
      "op": "setProperty",
      "target": "style",
      "args": ["width", "20px; color: red"],
      "observe": ["return", "exception", "cssText", "length", "items"]
    },
    {
      "op": "getPropertyValue",
      "target": "style",
      "args": ["width"],
      "observe": ["return", "exception", "cssText"]
    }
  ]
}
